id,text,label,origin,type,language,split,text_original
en_6146,L'ITI doit cesser d'embaucher des enseignants qui ont déjà pris leur retraite pour occuper celui-ci... je suis en overdose de vyvanse en essayant de rester éveillé,0,translated_en,tweet,fr,SMM4H_26_train,ITI needs to quit hiring teachers that have already retired from one job to take this one... imma overdose on vyvanse trying to stay awake
en_2598,"Le dénosumab (Xgeva), le bevacizumab (Avastin), le sunitinib (Sutent) sont liés à l'ostéonécrose de la mâchoire. #ONJ #denosumab #Avastin #Sutent",0,translated_en,tweet,fr,SMM4H_26_train,"Denosumab (Xgeva), Bevacizumab (Avastin), Sunitinib (Sutent) are linked to Osteonecrosis of the Jaw. #ONJ #denosumab #Avastin #Sutent"
en_1512,@USER_____ profitez d'Urslf Antara ☺ @USER___________,0,translated_en,tweet,fr,SMM4H_26_train,@USER_____ enjoy urslf antara ☺ @USER___________
en_16375,xarelto comment vas-tu,0,translated_en,tweet,fr,SMM4H_26_train,xarelto how are you
en_7152,"@USER_______, c'est vraiment rare de ressentir cela avec la quétiapine - j'obtiens tous les effets secondaires étranges :(",0,translated_en,tweet,fr,SMM4H_26_train,@USER_______ it's really rare to experience that on quetiapine- i get all the strange side effects :(
en_47,Les espèces végétales généralement menacées sont très négligées et l'équipe @USER__________ est heureuse de travailler sur les espèces de Taxus menacées. #JournéedesEspècesEndangered HTTPURL________________,0,translated_en,tweet,fr,SMM4H_26_train,Generally endangered plant species are much overlooked and @USER__________ team is happy to work on endangered Taxus species. #EndangeredSpeciesDay HTTPURL________________
en_11846,La trazadone peut faire des merveilles.,0,translated_en,tweet,fr,SMM4H_26_train,Trazadone can do wonders.
en_371,JUSTE MAINTENANT : Alembic Pharma obtient l’approbation de l’USFDA pour les comprimés de Telmisartan,0,translated_en,tweet,fr,SMM4H_26_train,JUST NOW: Alembic Pharma gets USFDA approval for Telmisartan tablets
en_7847,"Depuis que j'ai 40 ans, je passe une mammographie.  22/08/17 On m'a diagnostiqué un cancer de stade 1A. 22/09/17 J'ai subi une tumorectomie au sein gauche. 30/10/17- 21 traitements de radiation. Je prends du Tamoxifène TOUS LES JOURS. Je suis à la salle de sport, je mange Bio et je vis ma vie ! PUTAIN DE CANCER",0,translated_en,tweet,fr,SMM4H_26_train,"Since I was 40 yrs old I've gotten a mammogram.  8/22/17 I was diagnosed with stage 1A Cancer. 9/22/17 I had a Lumpectomy on my left breast. 10/30/17- 21 treatments of Radiation. I take Tamoxifen EVERY DAY. I'm in the gym, I eat Organic and I am living my life! FUCK CANCER"
en_11559,"quoi de neuf, l'insomnie ? il est un peu trop tard pour prendre une trazodone maintenant... #fuck #whatissleep",0,translated_en,tweet,fr,SMM4H_26_train,what's up insomnia? it's a little too late to take a trazodone now... #fuck #whatissleep
en_9807,je sors me promener sur lunesta #classicrockdiagnoses,0,translated_en,tweet,fr,SMM4H_26_train,i go out walking on lunesta #classicrockdiagnoses
en_9275,"""@USER___________ : adderall m'a demandé d'utiliser des ciseaux pour tondre ma pelouse."" @USER______ ou votre pinceau😂",0,translated_en,tweet,fr,SMM4H_26_train,“@USER___________: adderall had me using scissors to cut my lawn.” @USER______ or your paint brush😂
en_6427,Adam et Juliana me quittent pour 43 jours 😫😭 emmène-moi avec toiuuu !  j'ai besoin de cymbalta 💊💊#depressionhurts,0,translated_en,tweet,fr,SMM4H_26_train,adam and juliana are leaving me for 43 days 😫😭 take me with youuuu!  i need cymbalta 💊💊#depressionhurts
en_14464,l'hôtel le Meridia #latakia n'aura aucune chance face aux barils d'explosifs d'Assad et à l'armée #syriapic.twitter.com/71U8IGDrOY,0,translated_en,tweet,fr,SMM4H_26_train,le meridia hotel #latakia wont stand a chance from assad barrel bombs and army    #syriapic.twitter.com/71U8IGDrOY
en_14552,@USE Mère Nature a besoin d'un Prozac. Ces pauvres gens ont besoin d’une pause.,0,translated_en,tweet,fr,SMM4H_26_train,@USE Mother Nature needs a Prozac. Those poor people need a break.
en_4131,"ne laisse jamais ta mère plaisanter sur les publicités contre la dépression, elle insistera sur le fait que latuda n'est qu'une pilule française contre les pets #lovememum",0,translated_en,tweet,fr,SMM4H_26_train,"never let your mom joke about depression ads, she'll insist that latuda is just a french fart pill #lovememum"
en_2566,"4 types de médicaments, 2 types de pastilles, une cuillerée de miel et maintenant de la glace. Y a-t-il d'autres remèdes contre la toux ?",0,translated_en,tweet,fr,SMM4H_26_train,"4 types of medicine, 2 types of lozenge, spoonful of honey and now ice. Any other cough remedies?"
en_2634,"@USER_________ ""La fluoxétine (Prozac) est le seul médicament approuvé par la Food and Drug Administration (FDA) des États-Unis pour traiter la boulimie""",0,translated_en,tweet,fr,SMM4H_26_train,"@USER_________ ""fluoxetine (Prozac), is the only medication approved by the U.S. Food and Drug Administration (FDA) for treating bulimia"""
en_15464,"@USER__________ ... cela pourrait signifier que je me défonce à nouveau. Mais j'ai un supplément de quétiapine que je peux prendre, juste au cas où.",0,translated_en,tweet,fr,SMM4H_26_train,"@USER__________ ...could mean I'm going high again. But I have extra quetiapine I can take, just in case."
en_817,Pensez-vous que vos symptômes de marche se sont améliorés depuis le début de Tysabri ? Combien de perfusions a-t-il fallu avant que vous vous sentiez mieux ??,0,translated_en,tweet,fr,SMM4H_26_train,Do you think your walking symptoms have improved since starting Tysabri ? How many infusions did it take before you felt better ??
en_10521,Lady a demandé quelle est la différence entre les comprimés de Venlafaxine et les comprimés m/r. Je lui ai dit que c'était beaucoup de bonheur d'un seul coup ou un peu tout au long de la journée.,0,translated_en,tweet,fr,SMM4H_26_train,Lady asked what's difference between Venlafaxine tabs & m/r tabs. Told her it's a lot of happiness in one go or a little throughout the day.
en_15757,Braeburn va soulager la dépendance et la douleur aux opioïdes en Amérique du Nord grâce à la buprénorphine hebdomadaire de Camurus pour 151 millions de dollars,0,translated_en,tweet,fr,SMM4H_26_train,Braeburn to provide relief for opioid dependence/pain in N America with Camurus' weekly buprenorphine for $151m
en_875,Pastille pour chatte. #illexplainplustard,0,translated_en,tweet,fr,SMM4H_26_train,Cunt lozenge. #illexplainlater
en_12836,problème de biodiesel dissolution des pastilles dans votre cuve utilisant un bunker de sporophytes,0,translated_en,tweet,fr,SMM4H_26_train,biodiesel trouble lozenge dissolution thine tub utilizing sporophyte bunker
en_3974,"Manger du Paléo mais prendre du Prozac va un peu à l’encontre de l’objectif, n’est-ce pas ?",0,translated_en,tweet,fr,SMM4H_26_train,"Eating Paleo but taking Prozac kinda defeats the purpose, right?"
en_11194,"@USER__________ @USER_______ pourquoi prescrire la marque Avelox alors que la lévofloxacine générique fonctionne tout aussi bien ? Pas pour l'ACA, mais soyez conscient de...",0,translated_en,tweet,fr,SMM4H_26_train,"@USER__________ @USER_______ why prescribe brand Avelox when generic levofloxacin works just as well? Not for the ACA, but be cognisant of.."
en_4130,"je suis dans un magasin de jeux vidéo et il y a tellement de mecs ici avec leur mère comme des hommes chauves adultes, bon sang, que quelqu'un me donne un prozac",0,translated_en,tweet,fr,SMM4H_26_train,i'm at a videogame store and there's so many dudes here with their mom like full grown balding men god damn somebody get me a prozac
en_9268,"@USER________ @USER______ @USER______ peut-être qu'avec un entraîneur comme celui-ci, l'équipe n'a pas toutes les explosions qu'elle a eues sous Losange Boy ?",0,translated_en,tweet,fr,SMM4H_26_train,@USER________ @USER______ @USER______ maybe with a coach like this the team doesn't have all the blowups they've had under lozenge boy?
en_10404,je dois m'apporter du prozac,0,translated_en,tweet,fr,SMM4H_26_train,gotta get me some prozac
en_7985,@USER________ jugement de ma santé mentale latuda et encore une chose,0,translated_en,tweet,fr,SMM4H_26_train,@USER________ judgement of my sanity latuda and one more thing
en_6320,"Prise de vue d'Humira terminée - espérons-le, une bouée de sauvetage",0,translated_en,tweet,fr,SMM4H_26_train,Humira shot done - hopefully a lifesaver
en_3230,@USER_________ @USER_______ Le diclofénac est toujours en vente libre x,0,translated_en,tweet,fr,SMM4H_26_train,@USER_________ @USER_______ Diclofenac is still OTC x
en_10874,$SNY souligne les différences entre Afrezza et Exubera $MNKD #sizematterspic.twitter.com/7aBof8TLqp,0,translated_en,tweet,fr,SMM4H_26_train,$SNY emphasizes differences btw Afrezza and Exubera $MNKD #sizematterspic.twitter.com/7aBof8TLqp
en_7227,"iv dans votre veine, vous nourrissant de darvocet liquide",0,translated_en,tweet,fr,SMM4H_26_train,iv in your vein feeding you liquid darvocet
en_9945,Aranesp est l'une des choses les plus effrayantes que j'ai jamais rencontrées pour de nombreuses raisons...,0,translated_en,tweet,fr,SMM4H_26_train,Aranesp is one of the scariest things I've ever encounter for so many reasons...
en_7470,"Je prends mon aspirine et mon paxil, alias Sierra Nevada Torpedo et mes tampons Red Congolais. Je me sens déjà mieux.",0,translated_en,tweet,fr,SMM4H_26_train,Taking my aspirin and paxil aka Sierra Nevada Torpedo and Red Congolese dabs. Feeling better already.
en_5081,La suppression du gène du récepteur du #glucagon avant et après le #diabète expérimental révèle une protection différentielle contre l'#hyperglycémie #GCGR #GLP1 #insuline #tamoxifène HTTPURL________________ HTTPURL________________,0,translated_en,tweet,fr,SMM4H_26_train,Deletion of the #glucagon receptor gene before and after experimental #diabetes reveals differential protection from #hyperglycemia #GCGR #GLP1 #insulin #tamoxifen HTTPURL________________ HTTPURL________________
en_9813,L'étanercept est l'une des gammes de ttt pour la PR. Cela peut provoquer la réactivation d’une tuberculose latente. Un test PPD serait donc indispensable.,0,translated_en,tweet,fr,SMM4H_26_train,"Etanercept is one of the lines of ttt for RA. It may cause reactivation of latent tuberculosis, So a PPD test would be essential."
en_17350,"@USER_________ Paxil ? Tout va bien, merci mon pote.",0,translated_en,tweet,fr,SMM4H_26_train,@USER_________ Paxil? Am all good thanks pal.
en_5026,Tellement fatigué. Encore une scène. Pas besoin de lunesta ce soir.,0,translated_en,tweet,fr,SMM4H_26_train,So tired. One more scene. Needn't a lunesta tonight.
en_4964,"Après avoir expliqué le mode d'action du lipitor et du métoprolol à mon patient âgé, ""Merci, chérie, personne ne m'a jamais rien expliqué auparavant"".",0,translated_en,tweet,fr,SMM4H_26_train,"After explaining MOA of lipitor and metoprolol to my elderly patient 'Thank you, hon, ain't no one never explained nothing to me before'"
en_9182,"@USER__________ recommandé : paxil et/ou cannabis + temps. été là, cela arrive à tout le monde qui n'est pas un robot.",0,translated_en,tweet,fr,SMM4H_26_train,"@USER__________ recommended: paxil &amp;/or cannabis + time. been there, happens to every1 that is not a robot."
en_12562,"@USER___ Avec tous les procès Gardasil, il s'agit désormais d'un problème juridique et non médical. L’histoire du Vioxx a évolué de la même manière.",0,translated_en,tweet,fr,SMM4H_26_train,"@USER___ With all the Gardasil lawsuits, this is now a legal and not medical issue. The Vioxx story evolved in a similar fashion."
en_1689,@USER___________ @USER______ @USER____ @USER_________ AD utilise ADVAIR comme inhalateur de secours. C'est son accessoire. L'utilise pour attirer l'attention. Endommage 2 poumons,0,translated_en,tweet,fr,SMM4H_26_train,@USER___________ @USER______ @USER____ @USER_________ AD uses ADVAIR as rescue inhaler.It's her prop.Uses it 2 get attention.Damage 2 lungs
en_6388,enlevez les enfants de ces conneries supplémentaires ! La d-cyclosérine pourrait être la réponse #cogneuro,0,translated_en,tweet,fr,SMM4H_26_train,take the kids off that adderall crap! d-cycloserine could be the answer #cogneuro
en_15662,"#news zydus cadila obtient l'approbation de l'usfda pour un médicament anti-hypertension : commercialiser le telmisartan aux dosages de 20 mg, 40 mg et 80 mg #rt",0,translated_en,tweet,fr,SMM4H_26_train,"#news zydus cadila gets usfda nod for anti-hypertension drug: to market telmisartan in the strengths of 20 mg, 40 mg and 80 mg  #rt"
en_8874,Seroquel est amusant. Je viens de raconter à papa le rêve que j'ai fait la nuit dernière où j'étais Hannah Montana et je chantais le hoedown throwdown. Mdr.,0,translated_en,tweet,fr,SMM4H_26_train,Seroquel is fun. Just told dad about the dream I had last night where I was Hannah Montana and I sung the hoedown throwdown. Lol.
en_10960,Exelon a annoncé aujourd'hui ses résultats pour le deuxième trimestre : le bénéfice de l'unité @USER_______ au deuxième trimestre a augmenté de 17 % pour atteindre 84 millions de dollars.  Pas un mot sur l’amélioration du réseau. @UTILISATEUR_____,0,translated_en,tweet,fr,SMM4H_26_train,Exelon reported 2Q earnings today -- @USER_______ unit's 2Q profit rose 17% to $84 Mln.  Not a word about improving the grid. @USER_____
en_14328,"@USER__________ @USER___ @USER___ hein, je ne suis pas le malheureux qui doit rester dans la pièce.  J'ai déjà distribué le Geodon",0,translated_en,tweet,fr,SMM4H_26_train,"@USER__________ @USER___ @USER___ eh, I'm not the unfortunate soul who has to stay in the room.  I already handed out the Geodon"
en_9113,"""@USER________ : les personnes déprimées consultent régulièrement les notifications de Twitter, Facebook, e-mails et SMS."" du prozac ??",0,translated_en,tweet,fr,SMM4H_26_train,"""@USER________: depressed people check notifications for twitter, facebook, e-mails, and text messages regularly."" prozac??"
en_5849,#askadoc se prépare à démarrer enbrel pour Psa. Qu'en penses-tu?,0,translated_en,tweet,fr,SMM4H_26_train,#askadoc getting ready to start enbrel for Psa. What do you think?
en_8438,Cet Imodium m'a sauvé.,0,translated_en,tweet,fr,SMM4H_26_train,This Imodium saved me.
en_11029,"je pense que je vais arrêter de prendre les comprimés de témazépam, je ne pense pas qu'ils m'aident à dormir autant que le seroquel",0,translated_en,tweet,fr,SMM4H_26_train,"i think im gonna stop taking the temazepam tablets, I don't think they help me sleep as much as seroquel does"
en_10287,je vais leur glisser un de mes vyvanse dans leurs boissons.,0,translated_en,tweet,fr,SMM4H_26_train,i'm gonna slip them one of my vyvanse in their drinks.
en_17205,Je suis une personne tellement plus heureuse quand je prends Vyvanse,0,translated_en,tweet,fr,SMM4H_26_train,I'm such a happier person when I take vyvanse
en_14097,@USER_____ Je pense que #Dexter a besoin de quelques-uns de ces Paxil ce soir !,0,translated_en,tweet,fr,SMM4H_26_train,@USER_____ I think #Dexter needs a couple of those Paxil tonight!
en_6359,@USER_________ Explique pourquoi j'ai à peine pu marcher jusqu'à la chambre et en plus je prends du Temazepam !!!,0,translated_en,tweet,fr,SMM4H_26_train,@USER_________ Explains why ive hardly been able to walk to bedroom and on top of tht id be taking Temazepam !!!
en_1535,De retour du psychiatre. Elle m'a prescrit Viibryd et Ambien. Je vais vraiment devenir fou maintenant loliez. ;) :P,0,translated_en,tweet,fr,SMM4H_26_train,Back from the Psychiatrist. She prescribed me Viibryd and Ambien. I'm really going to be loopy now loliez. ;) :P
en_6678,@USER______ mais les autres utilisateurs supplémentaires sont tous cool 4 moi,0,translated_en,tweet,fr,SMM4H_26_train,@USER______ but the other adderall users all r 2 cool 4 me
en_13144,"et le médecin généraliste m'a prescrit du témazépam, ouais, j'espère que je dormirai mieux ce soir !!",0,translated_en,tweet,fr,SMM4H_26_train,and the gp has prescribed me some temazepam yaaaay hopefully il get some better sleep tonight!!
en_10693,"@USER_________ Mavis, puis-je recommander 60 mg de fluoxétine par jour pour soulager votre trouble obsessionnel compulsif ??  #McCann",0,translated_en,tweet,fr,SMM4H_26_train,"@USER_________  Mavis, may I recommend 60mg of fluoxetine daily to help with your obsessive compulsive disorder??  #McCann"
en_8365,... la cymbalta peut vous aider..,0,translated_en,tweet,fr,SMM4H_26_train,... cymbalta can help..
en_9488,L’utilisation hors AMM du #Létrozole dans le #SOPK peut-elle être recommandée ? HTTPURL________________,0,translated_en,tweet,fr,SMM4H_26_train,Can off label use of #Letrozole in #PCOS be recommended? HTTPURL________________
en_4158,Fmge Le seuil de convulsions avec la ciprofloxacine est augmenté de ? A. Ampicilline B. Amiodorone C. Théophylline D. Tous les éléments ci-dessus,0,translated_en,tweet,fr,SMM4H_26_train,Fmge  Seizure threshold with ciprofloxacin is increased by? A. Ampicillin B. Amiodorone C. Theophyllin D. All of the abve
en_10932,Aucune preuve de CRHOHN dans mes entrailles. #BOOYAH #HUMIRA #EFFECTIVEMEDICNE See More,0,translated_en,tweet,fr,SMM4H_26_train,NO EVIDENCE OF CRHOHN'S IN MY BOWELS. #BOOYAH #HUMIRA #EFFECTIVEMEDICNE
en_15379,brevet intéressant sur Enbrel Brevet américain 8 063 182,0,translated_en,tweet,fr,SMM4H_26_train,"interesting patent on Enbrel U.S Patent 8,063,182"
en_7355,rt @USER__________ : @USER__ @USER___ seule l'olanzapine peut nous guérir... priez avec nous... l'impératrice peut encore entendre nos pitoyables supplications !,0,translated_en,tweet,fr,SMM4H_26_train,rt @USER__________: @USER__ @USER___ only olanzapine can fix us... pray with us... the empress may yet hear our pitiful supplications!
en_14962,@USER_____ change ton nom en tazmar,0,translated_en,tweet,fr,SMM4H_26_train,@USER_____ change your name to tazmar
en_7014,combien de fois vas-tu dire xarelto ?,0,translated_en,tweet,fr,SMM4H_26_train,how many time are you going to say xarelto?
en_14404,Merci à Dieu pour Zyprexa.,0,translated_en,tweet,fr,SMM4H_26_train,Thank God for Zyprexa.
en_12365,"@USER__________ ouais pareil, j'étais sous quétiapine mais ils m'ont fait passer à l'aripiprazole, je ne suis même pas sûr que cela fonctionne car j'ai passé la soirée à pleurer",0,translated_en,tweet,fr,SMM4H_26_train,@USER__________ yeah same i was on quetiapine but they switched me to aripiprazole not even sure it works as spent evening crying
en_9506,"@USER__________ @USER__________ Salut Linnea. Je prends de la gabapentine et du mégestrol pour les bouffées de chaleur causées par le tamoxifène. J'ai commencé avec de la gabapentine, ce qui m'a aidé, mais les bouffées de chaleur restaient insupportables. Ensuite, nous avons ajouté le mégestrol et pratiquement sans bouffées de chaleur et sans effets secondaires.",0,translated_en,tweet,fr,SMM4H_26_train,@USER__________ @USER__________ Hi Linnea. I am taking gabapentin and megestrol for hot flashes caused by tamoxifen. I started out with gabapentin which helped but hot flashes were still unbearable. Then we added the megestrol and pretty much hot flash free with no side effects.
en_9467,Dr augmentant la gabapentine à 600 mg 2x/jour et 900 mg 1x/jour. Changer les analgésiques de 10 mg toutes les 8 heures à 5 mg toutes les 3 heures avec une pause de 6 heures lorsque je dors.,0,translated_en,tweet,fr,SMM4H_26_train,Dr upping Gabapentin to 600mg 2x/day & 900mg 1x/day. Changing pain pills from 10mg every 8hrs to 5mg every 3hrs w/a 6hr break when I sleep.
en_8705,Je viens d'être contraint de participer à un autre dîner avec Xarelto demain soir... #freefoodiguess #ihopemybossbails,0,translated_en,tweet,fr,SMM4H_26_train,Just got coerced into another dinner with Xarelto tomorrow night...  #freefoodiguess #ihopemybossbails
en_4493,Dang l'a commandé à 15h00 HNE. Je l'ai reçu à 9h25. J'ai dû me prendre au sérieux quand j'ai dit que je ne pouvais pas attendre cc @USER_______ #rheum #enbrel,0,translated_en,tweet,fr,SMM4H_26_train,Dang ordered it at 3:00pm EST Got it at 9:25 am. Must have taken me seriously when I said I couldn't wait cc @USER_______ #rheum #enbrel
en_9759,L'association du médicament antitabac varénicline avec un traitement de remplacement de la nicotine s'est avérée plus efficace que la varénicline seule à...,0,translated_en,tweet,fr,SMM4H_26_train,Combining the smoking cessation medication varenicline with nicotine replacement therapy was more effective than varenicline alone at...
en_16903,@USER__________ soyez conscient des médicaments comme Lyrica qui masquent la douleur. état toujours là. réparer la neuropathie et amp; la douleur s'en va.,0,translated_en,tweet,fr,SMM4H_26_train,@USER__________ be aware of meds like lyrica that mask pain. condition still there. fix the neuropathy &amp; the pain goes away.
en_11146,@USER______ Haha... Je suis sous avelox. 400 mg. Un par jour. Postan Forte. Trois fois par jour. J'aimerais que la bière soit un antibiotique.,0,translated_en,tweet,fr,SMM4H_26_train,@USER______ Haha... I'm on avelox. 400 mg. One daily. Postan Forte. Thrice a day. I wish beer was an anti-biotic.
en_3363,est-ce que symbicort triche ?,0,translated_en,tweet,fr,SMM4H_26_train,is symbicort cheating?
en_11369,"@USER__________ Absolument. Le créateur est le pire contrevenant en matière de « prime non gagnée ». Mais les $AZN sont des champions. Top 3 : Crestor, Nexium et maintenant Brillanta",0,translated_en,tweet,fr,SMM4H_26_train,"@USER__________ Absolutely. Creator is worst offender for ""unearned premium"". But $AZN are champions. Top 3: Crestor, Nexium & now Brillanta"
en_2698,"C'est la première fois que je prends Adderall depuis environ 2 ans. Cela me fait penser à des mots sympas, comme galvanique et exubérance",0,translated_en,tweet,fr,SMM4H_26_train,"This is the first time I've been on adderall in about 2 years. It makes me think of cool words, such as galvanic and exuberance"
en_5618,"@USER___ Cela me rappelle le slogan d'Imodium : ""Pourquoi s'inquiéter du retour de votre crise de diarrhée ?"" Pourquoi tu penses, mon pote ? Je me suis cassé la dernière fois",0,translated_en,tweet,fr,SMM4H_26_train,"@USER___ Reminds me of the Imodium slogan, ""Why worry about your diarrhoea attack coming back?"" Why d'ya think, pal? I shat myself last time"
en_15039,Dex hier soir et ce soir et c'est Velcade aujourd'hui. Le combat continue. #MyélomeSucks,0,translated_en,tweet,fr,SMM4H_26_train,Dex last night & tonight and it's Velcade today. The fight continues. #MyelomaSucks
en_9443,@USER___________ @USER______ on t'envoie des kleenex et de l'imodium pour t'aider à chier dessus ? peut-être aussi de la crème pour les hémorroïdes ?,0,translated_en,tweet,fr,SMM4H_26_train,@USER___________ @USER______ shall we send you some kleenex and some imodium to help you with shitting yourself? maybe cream for piles too?
en_4115,"Plus de données #dabigatran #ISTH2013 aujourd'hui. Pour une mise à jour sur les options d'annulation, rendez-vous sur ePoster 1.45-6, écran 45 à 17h00.",0,translated_en,tweet,fr,SMM4H_26_train,"More #dabigatran data #ISTH2013 today. For an update on reversal options head to ePoster 1.45-6, screen 45 @ 17:00"
en_7251,"intéressant! ""@USER_____ : les bananes contiennent un produit chimique naturel qui peut rendre une personne heureuse - le même produit chimique que celui présent dans le prozac.""",0,translated_en,tweet,fr,SMM4H_26_train,interesting! “@USER_____: bananas contain a natural chemical that can make a person happy - the same chemical found in prozac.”
en_7550,@UTILISATEUR____ Je me demande simplement combien de quétiapine je peux prendre en une seule fois pour m'assommer ???,0,translated_en,tweet,fr,SMM4H_26_train,@USER____ I'm just wondering how much Quetiapine I can take in one go to knock me out???
en_1615,Ma mère vient de m'informer que notre chien prend du Prozac.,0,translated_en,tweet,fr,SMM4H_26_train,My mother just informed me that our dog is on Prozac.
en_8264,"on m'a donc proposé une ordonnance de fluoxétine pour traiter la dépression/l'anxiété/le TOC, ce qui, je pensais, pourrait aider en général à guérir de l'anorexie.",0,translated_en,tweet,fr,SMM4H_26_train,so i've been offered a prescription for fluoxetine for depression/anxiety/ocd which i thought might help in general with anorexia recovery
en_15638,La metformine est souvent le médicament de choix pour le diabète de type 2 car elle présente de multiples avantages et est moins susceptible de provoquer une prise de poids.,0,translated_en,tweet,fr,SMM4H_26_train,Metformin is often the drug of choice for type 2 diabetes because it has multiple benefits and is less likely to cause weight gain.
en_6170,"@USER________ Mais je ne peux pas le pousser. Vous serez prêt quand vous serez prêt. J'ai pris du Prozac pendant près de 7 ans, puis @USER_________",0,translated_en,tweet,fr,SMM4H_26_train,@USER________ I can't push it tho. You'll be ready when you're ready. I was on Prozac for the better part of 7 yrs and then @USER_________
en_9425,"@USER__________ a souffert d'anxiété sociale pendant 4 ans lorsque j'ai eu ma première crise de panique, cela a empiré quand je suis allé à l'université, alors je viens de commencer paxil",0,translated_en,tweet,fr,SMM4H_26_train,"@USER__________ suffered social anxiety for 4 yrs when i had my first panic attack,got worse when i went to uni, so have just started paxil"
en_15606,Que se passe-t-il lorsque vous prenez des laxatifs et Imodium,0,translated_en,tweet,fr,SMM4H_26_train,What happens when you take laxatives and Imodium
